{"case":{"caseId":"case:sha256:d29597a6a668589fe9e905432cd2439c8e687a32e0c17a216ec82feed3426b9a","constraints":{"runtime":"rust"},"contract":["define an error enum with a transparent variant and a formatted one","assert Display renders the declared message","assert #[from] converts the underlying error automatically","assert the source chain survives so callers can inspect the cause"],"goal":"Define a library error type with thiserror and keep the source chain intact","kind":"HOW","packages":["pkg:cargo/thiserror@2.0.20"],"schemaVersion":1,"symbols":["thiserror::Error","source","From"]},"contractCommand":["cargo","run","--offline","--quiet"],"environment":{"arch":"x64","ecosystem":"cargo","executionContext":"rust","language":"rust","os":"linux","packageManager":"cargo","runtime":"rust","runtimeVersion":"1","schemaVersion":1},"license":"MIT-0","packages":["pkg:cargo/thiserror@2.0.20"],"schemaVersion":1,"symbols":["thiserror::Error","source","From"],"verifierAdapter":"cargo@1"}
