{"case":{"caseId":"case:sha256:34dd4fe900fe98e5efc57f1e6adf30bbfb1b25c246a51886d6b43bf4a2a37303","constraints":{"moduleSystem":"esm","runtime":"node"},"contract":["start a local echo server","POST one JSON body to it","assert the server received the exact body"],"goal":"Upload JSON with axios.post and verify the echo server receives it","kind":"HOW","packages":["pkg:npm/axios@1.12.0"],"schemaVersion":1,"symbols":["axios.post"]},"contractCommand":["node","test/contract.mjs"],"environment":{"arch":"x64","ecosystem":"npm","executionContext":"node","moduleSystem":"esm","os":"linux","runtime":"node","schemaVersion":1},"license":"MIT-0","packages":["pkg:npm/axios@1.12.0"],"schemaVersion":1,"symbols":["axios.post"],"verifierAdapter":"node-typescript@1"}
