{"case":{"believed":"marked 13 throws when async: false conflicts with an async extension, and its Markdown output sanitizes dangerous raw HTML.","caseId":"case:sha256:b784193fac8adc716ff3d8138dab5bc309af415bd10702e849abe294b804c179","constraints":{"moduleSystem":"esm","runtime":"node"},"contract":["marked.parse returns an HTML string synchronously by default","passing async: true returns a Promise that resolves to the same HTML","an async Marked extension awaits walkTokens mutations; a per-call async: false override warns, is ignored, and still returns a Promise","raw HTML and event-handler attributes pass through unchanged because marked does not sanitize output"],"goal":"Parse Markdown with marked 13.0.2 while preserving its synchronous, asynchronous, and raw-HTML trust boundaries","kind":"HOW","packages":["pkg:npm/marked@13.0.2"],"schemaVersion":1,"symbols":["marked","marked.parse","Marked.use","walkTokens"]},"contractCommand":["node","test/contract.mjs"],"environment":{"arch":"x64","ecosystem":"npm","executionContext":"node","language":"javascript","moduleSystem":"esm","os":"linux","packageManager":"npm","runtime":"node","runtimeVersion":"22","schemaVersion":1},"license":"MIT-0","packages":["pkg:npm/marked@13.0.2"],"schemaVersion":1,"symbols":["marked","marked.parse","Marked.use","walkTokens"],"verifierAdapter":"node-typescript@1"}
