{"schemaVersion": 1, "case": {"schemaVersion": 1, "kind": "FIX", "goal": "Stop go-playground/validator rejecting a supplied zero value as a missing required field", "packages": ["pkg:golang/github.com/go-playground/validator/v10@10.28.0"], "symbols": ["validator.New", "Validate.Struct", "validator.ValidationErrors"], "constraints": {"runtime": "go"}, "contract": ["assert required rejects an int 0 and a bool false that were supplied", "assert a range violation reports the range tag rather than required", "assert a pointer plus required means present, so a pointer to false passes", "assert omitempty skips a nil pointer but not a present zero value"]}, "packages": ["pkg:golang/github.com/go-playground/validator/v10@10.28.0"], "symbols": ["validator.New", "Validate.Struct", "validator.ValidationErrors"], "environment": {"schemaVersion": 1, "ecosystem": "golang", "os": "linux", "arch": "x64", "runtime": "go", "runtimeVersion": "1.26", "language": "go", "executionContext": "go", "packageManager": "go"}, "license": "MIT-0", "contractCommand": ["go", "run", "./test"], "verifierAdapter": "golang@1"}
