{"schemaVersion": 1, "case": {"schemaVersion": 1, "kind": "FIX", "goal": "Make chalk emit colour codes when output is piped instead of silently producing plain text", "packages": ["pkg:npm/chalk@6.0.0"], "symbols": ["Chalk"], "constraints": {"runtime": "node", "moduleSystem": "esm"}, "contract": ["construct a Chalk instance with an explicit level", "assert the styled string contains the expected ANSI escape codes", "assert a level 0 instance returns the text unchanged"]}, "packages": ["pkg:npm/chalk@6.0.0"], "symbols": ["Chalk"], "environment": {"arch": "x64", "ecosystem": "npm", "executionContext": "node", "moduleSystem": "esm", "os": "linux", "packageManager": "npm", "runtime": "node", "runtimeVersion": "22", "schemaVersion": 1}, "license": "MIT-0", "contractCommand": ["node", "test/contract.mjs"], "verifierAdapter": "node-typescript@1"}
