{"schemaVersion": 1, "case": {"schemaVersion": 1, "kind": "FIX", "goal": "Do timezone-aware date math without the day drifting", "packages": ["pkg:npm/luxon@3.7.2"], "symbols": ["DateTime.fromISO", "setZone", "diff"], "constraints": {"runtime": "node", "moduleSystem": "esm"}, "contract": ["parse an ISO timestamp into a named zone", "assert the same instant renders as different local days in two zones", "assert adding days across a DST boundary keeps the wall-clock time", "assert an invalid zone is reported rather than silently ignored"]}, "packages": ["pkg:npm/luxon@3.7.2"], "symbols": ["DateTime.fromISO", "setZone", "diff"], "environment": {"schemaVersion": 1, "ecosystem": "npm", "os": "linux", "arch": "x64", "runtime": "node", "runtimeVersion": "22", "language": "javascript", "executionContext": "node", "packageManager": "npm", "moduleSystem": "esm"}, "license": "MIT-0", "contractCommand": ["node", "test/contract.mjs"], "verifierAdapter": "node-typescript@1"}
