{"case":{"caseId":"case:sha256:693f47ea50a1edfd061457ba683289306ba9ebd242c8ad0f57880ccb2c1cb8be","constraints":{"runtime":"rust"},"contract":["assert the bare io::Error for a missing path is NotFound and its Display carries os error 2","assert Display of a context-wrapped error prints only the outermost context, not the io message","assert alternate Display {:#} flattens the whole chain into one colon-joined line while {} does not","assert chain() yields both context frames then the original io error, in that order","assert root_cause() returns the original io error at the bottom of the chain","assert Debug {:?} prints the multi-line report with a Caused by section","assert anyhow::Error derefs to a dyn StdError that prints as the outermost frame, and that source() through that Deref yields the next frame","assert downcast_ref recovers the io::Error and its NotFound kind through two layers of context","assert downcast_ref recovers a concrete thiserror library type out of a context-wrapped anyhow error","assert anyhow::Error is one pointer wide, smaller than the concrete thiserror error, which is as wide as its String field","assert bail! and ensure! build a one-frame error from a plain message with no source","assert an interpolated bail! message downcasts to String while an anyhow! bare literal downcasts to \u0026str","assert io::Error and ParseIntError both convert through ? with no From impl written","assert context() on a None Option produces an error with no source","assert with_context never runs its closure on the success path while context() builds its message even when the Result is Ok"],"goal":"Handle errors in a Rust application with anyhow: attach context, keep the cause chain, log it without losing the cause, and recover the concrete error","kind":"HOW","packages":["pkg:cargo/anyhow@1.0.104","pkg:cargo/thiserror@2.0.20"],"schemaVersion":1,"symbols":["anyhow::Context::context","anyhow::Context::with_context","anyhow::Error::chain","anyhow::Error::root_cause","anyhow::Error::downcast_ref","anyhow::bail","anyhow::ensure"]},"contractCommand":["cargo","run","--offline","--quiet"],"environment":{"arch":"x64","ecosystem":"cargo","executionContext":"rust","language":"rust","os":"linux","packageManager":"cargo","runtime":"rust","runtimeVersion":"1","schemaVersion":1},"license":"MIT-0","packages":["pkg:cargo/anyhow@1.0.104","pkg:cargo/thiserror@2.0.20"],"schemaVersion":1,"symbols":["anyhow::Context::context","anyhow::Context::with_context","anyhow::Error::chain","anyhow::Error::root_cause","anyhow::Error::downcast_ref","anyhow::bail","anyhow::ensure"],"verifierAdapter":"cargo@1"}
