{"case":{"caseId":"case:sha256:2c0ffbf9019c810ab1c35541b372a32c4b58ca8e91ea24d7024cf03a0c7ae38e","constraints":{"runtime":"dart"},"contract":["assert a payload whose every field has the wrong type still decodes, that reading a field out of it still succeeds because both are typed dynamic, and that the first failure is a TypeError at the first typed use in code that never mentions JSON, with reviver the only hook that runs during the decode itself","assert a decoded array is List\u003cdynamic\u003e and is not a List\u003cString\u003e even when every element is a String, and that the usual .cast\u003cString\u003e() fix defers again into a lazy view whose construction and length succeed with a bad element inside while reading that element throws, where List\u003cString\u003e.from fails at the decode","assert a JSON number is int or double according to how it was spelled, so as int rejects 3.0 and as double rejects 3, that num survives both at the cost of a silent truncation in toInt, and that an integer literal past the 64-bit range decodes as a double with its low digits already gone","assert a missing key reads back as null without throwing and is indistinguishable from an explicit null except through containsKey, that it becomes a TypeError in a non-nullable field and silence in a nullable one, and that $checkKeys separates missing, unrecognized and disallowed-null into three named exceptions before any value is read","assert decoding gives a String and encoding a DateTime throws, that DateTime.parse returns UTC for a numeric offset as well as for a trailing Z so the offset is lost on the way out rather than on the way in, that toIso8601String writes no zone designator at all for a non-UTC value, and that the round trip is not == the original because DateTime's == compares the isUtc flag","assert jsonEncode resolves toJson by dynamic dispatch with no interface involved, that a class without one throws JsonUnsupportedObjectError caused by NoSuchMethodError, and that a toJson returning an unencodable value re-attributes the error to your class with the real offender only reachable through cause","assert $checkedCreate and $checkedConvert turn the same TypeError into a CheckedFromJsonException naming the class and the JSON key, including the key rather than the Dart field name and including a key that was missing, while leaving a good payload untouched","assert @JsonSerializable and @JsonKey change nothing at runtime without the generator, so the declared rename and default value are ignored and the hand-written code is what decides the wire key"],"goal":"Write fromJson and toJson by hand in Dart with dart:convert and json_annotation, with no build_runner and no generated file, and find out where an unchecked payload actually fails","kind":"HOW","packages":["pkg:pub/json_annotation@4.12.0"],"schemaVersion":1,"symbols":["jsonDecode","jsonEncode","JsonUnsupportedObjectError","JsonConverter","JsonKey","JsonSerializable","$checkedCreate","$checkedConvert","$checkKeys","CheckedFromJsonException","MissingRequiredKeysException","UnrecognizedKeysException","DisallowedNullValueException","DateTime.parse","DateTime.toIso8601String"]},"contractCommand":["dart","test","--reporter=expanded"],"environment":{"arch":"x64","ecosystem":"pub","executionContext":"dart","language":"dart","os":"linux","packageManager":"pub","runtime":"dart","runtimeVersion":"3","schemaVersion":1},"license":"MIT-0","packages":["pkg:pub/json_annotation@4.12.0"],"schemaVersion":1,"symbols":["jsonDecode","jsonEncode","JsonUnsupportedObjectError","JsonConverter","JsonKey","JsonSerializable","$checkedCreate","$checkedConvert","$checkKeys","CheckedFromJsonException","MissingRequiredKeysException","UnrecognizedKeysException","DisallowedNullValueException","DateTime.parse","DateTime.toIso8601String"],"verifierAdapter":"pub@1"}
