{"schemaVersion": 1, "case": {"schemaVersion": 1, "kind": "HOW", "goal": "Send pino output to your own stream and read the structured fields back", "packages": ["pkg:npm/pino@10.3.1"], "symbols": ["pino"], "constraints": {"runtime": "node", "moduleSystem": "esm"}, "contract": ["create a logger writing to a collecting stream", "log a message with extra fields", "assert the line is one JSON object with level 30 and the message", "assert the extra fields survived as top-level keys"]}, "packages": ["pkg:npm/pino@10.3.1"], "symbols": ["pino"], "environment": {"arch": "x64", "ecosystem": "npm", "executionContext": "node", "moduleSystem": "esm", "os": "linux", "packageManager": "npm", "runtime": "node", "runtimeVersion": "22", "schemaVersion": 1}, "license": "MIT-0", "contractCommand": ["node", "test/contract.mjs"], "verifierAdapter": "node-typescript@1"}
