{"schemaVersion": 1, "case": {"schemaVersion": 1, "kind": "FIX", "goal": "Import an npm package from Deno, where a bare specifier does not resolve", "packages": ["pkg:npm/nanoid@6.0.1"], "symbols": ["nanoid", "node:crypto.createHash", "Deno.permissions"], "constraints": {"runtime": "deno", "moduleSystem": "esm"}, "contract": ["map the npm package with an npm: specifier in deno.json", "assert the imported package works", "assert node: builtins produce the same result node would", "assert permissions are denied by default rather than granted"]}, "packages": ["pkg:npm/nanoid@6.0.1"], "symbols": ["nanoid", "node:crypto.createHash", "Deno.permissions"], "environment": {"schemaVersion": 1, "ecosystem": "npm", "os": "linux", "arch": "x64", "runtime": "deno", "runtimeVersion": "2", "language": "javascript", "executionContext": "deno", "packageManager": "deno", "moduleSystem": "esm"}, "license": "MIT-0", "contractCommand": ["deno", "test", "--cached-only"], "verifierAdapter": "node-typescript@1"}
