{"buildCommand":["sh","-c","mkdir -p /work/.csx-vendor/classes \u0026\u0026 javac -cp '/work/.csx-vendor/maven-jars/*' -d /work/.csx-vendor/classes src/Contract.java"],"case":{"believed":"AtomicLong deserialization of numeric strings and floating-point tokens is equivalent to integral-token deserialization, so values outside the 32-bit range cannot be silently narrowed on a 64-bit target.","caseId":"case:sha256:2445bb12525b9ae06b018f12e56065ec501672a16437a6cfec4016fef6462774","constraints":{"runtime":"java"},"contract":["A numeric string above Integer.MAX_VALUE deserializes to AtomicLong without 32-bit truncation.","A floating-point token above Integer.MAX_VALUE follows the default ACCEPT_FLOAT_AS_INT policy, drops only its fractional part, and preserves the 64-bit integral value.","A negative numeric string below Integer.MIN_VALUE preserves its negative 64-bit value.","A large integral token remains a full-width AtomicLong baseline, and an AtomicLong bean property uses the same corrected string-coercion path.","Disabling ACCEPT_FLOAT_AS_INT rejects floating-point input instead of silently coercing it.","Configuring integer String coercion to Fail rejects a quoted number instead of bypassing the policy."],"goal":"Prove Jackson Databind 2.21.4 preserves 64-bit AtomicLong values on coerced string and floating-point paths fixed in this patch, while still honoring strict coercion settings.","kind":"FIX","packages":["pkg:maven/com.fasterxml.jackson.core/jackson-annotations@2.21","pkg:maven/com.fasterxml.jackson.core/jackson-core@2.21.4","pkg:maven/com.fasterxml.jackson.core/jackson-databind@2.21.4"],"schemaVersion":1,"symbols":["ObjectMapper.readValue","AtomicLongDeserializer","AtomicLong","DeserializationFeature.ACCEPT_FLOAT_AS_INT","MutableCoercionConfig.setCoercion"]},"contractCommand":["sh","-c","java -cp '/work/.csx-vendor/classes:/work/.csx-vendor/maven-jars/*' Contract"],"environment":{"arch":"x64","compiler":"javac","compilerVersion":"21","ecosystem":"maven","executionContext":"java","language":"java","languageVersion":"21","libc":"musl","os":"linux","packageManager":"maven","packageManagerVersion":"3.9","runtime":"java","runtimeVersion":"21","schemaVersion":1},"license":"MIT-0","packages":["pkg:maven/com.fasterxml.jackson.core/jackson-annotations@2.21","pkg:maven/com.fasterxml.jackson.core/jackson-core@2.21.4","pkg:maven/com.fasterxml.jackson.core/jackson-databind@2.21.4"],"schemaVersion":1,"symbols":["ObjectMapper.readValue","AtomicLongDeserializer","AtomicLong","DeserializationFeature.ACCEPT_FLOAT_AS_INT","MutableCoercionConfig.setCoercion"],"verifierAdapter":"maven-java@1"}
