{"schemaVersion": 1, "case": {"schemaVersion": 1, "kind": "FIX", "goal": "Compare structs in tests where reflect.DeepEqual is wrong or unusable", "packages": ["pkg:golang/github.com/google/go-cmp@0.7.0"], "symbols": ["cmp.Diff", "cmp.Equal", "cmpopts.IgnoreFields"], "constraints": {"runtime": "go"}, "contract": ["assert cmp.Diff reports a readable difference", "assert unexported fields panic unless an option allows them", "assert IgnoreFields excludes a volatile field like a timestamp", "assert equal values produce an empty diff"]}, "packages": ["pkg:golang/github.com/google/go-cmp@0.7.0"], "symbols": ["cmp.Diff", "cmp.Equal", "cmpopts.IgnoreFields"], "environment": {"schemaVersion": 1, "ecosystem": "golang", "os": "linux", "arch": "x64", "runtime": "go", "runtimeVersion": "1.26", "language": "go", "executionContext": "go", "packageManager": "gomod"}, "license": "MIT-0", "contractCommand": ["go", "run", "./test"], "verifierAdapter": "go@1"}
