{"schemaVersion": 1, "case": {"schemaVersion": 1, "kind": "FIX", "goal": "Choose between renderToString and renderToStaticMarkup without breaking hydration", "packages": ["pkg:npm/react@19.2.8", "pkg:npm/react-dom@19.2.8"], "symbols": ["renderToString", "renderToStaticMarkup", "createElement"], "constraints": {"runtime": "node", "moduleSystem": "esm"}, "contract": ["render a component whose children include adjacent text nodes", "assert renderToString emits a comment separator at the text boundary", "assert renderToStaticMarkup omits it and is otherwise identical", "assert interpolated text is HTML-escaped"]}, "packages": ["pkg:npm/react@19.2.8", "pkg:npm/react-dom@19.2.8"], "symbols": ["renderToString", "renderToStaticMarkup", "createElement"], "environment": {"schemaVersion": 1, "ecosystem": "npm", "os": "linux", "arch": "x64", "runtime": "node", "runtimeVersion": "22", "language": "javascript", "executionContext": "node", "packageManager": "npm", "moduleSystem": "esm"}, "license": "MIT-0", "contractCommand": ["node", "test/contract.mjs"], "verifierAdapter": "node-typescript@1"}
