{"schemaVersion": 1, "case": {"schemaVersion": 1, "kind": "HOW", "goal": "Build and add to dates with chrono 0.4 without the deprecated constructors, and know when month arithmetic clamps", "packages": ["pkg:cargo/chrono@0.4.42"], "symbols": ["DateTime::from_timestamp", "NaiveDate::from_ymd_opt", "NaiveDateTime::and_utc", "NaiveDate::checked_add_months"], "constraints": {"runtime": "rust"}, "contract": ["assert DateTime::from_timestamp returns None out of range instead of panicking", "assert an impossible civil date is None and parsing refuses it", "assert and_utc converts a naive value to DateTime<Utc>", "assert month arithmetic clamps to the end of the month while day arithmetic does not", "assert adding one month twice differs from adding two months"]}, "packages": ["pkg:cargo/chrono@0.4.42"], "symbols": ["DateTime::from_timestamp", "NaiveDate::from_ymd_opt", "NaiveDateTime::and_utc", "NaiveDate::checked_add_months"], "environment": {"schemaVersion": 1, "ecosystem": "cargo", "os": "linux", "arch": "x64", "runtime": "rust", "runtimeVersion": "1", "language": "rust", "executionContext": "rust", "packageManager": "cargo"}, "license": "MIT-0", "contractCommand": ["cargo", "run", "--offline", "--quiet"], "verifierAdapter": "cargo@1"}
